{
  "id": "bucketeer",
  "name": "Bucketeer",
  "provider": "Bucketeer",
  "description": "Integrates with Bucketeer's open-source feature flag platform to provide complete CRUD operations for managing...",
  "classification": "official",
  "weekly_metric": null,
  "release_date": "Jul 17, 2025",
  "url": "https://www.pulsemcp.com/servers/bucketeer",
  "source_url": "https://github.com/bucketeer-io/bucketeer-mcp",
  "categories": [
    "api",
    "development",
    "git"
  ],
  "tags": [],
  "last_updated": null,
  "scraped_at": "2025-11-17T03:46:58.355535",
  "metadata": {
    "github_stars": 1,
    "capabilities": [
      "`getFeatureFlag` - Get a specific feature flag by ID",
      "`updateFeatureFlag` - Update an existing feature flag",
      "`createFeatureFlag` - Create a new feature flag",
      "`archiveFeatureFlag` - Archive a feature flag (make it inactive)",
      "`listFeatureFlags` - List all feature flags with filtering and pagination"
    ],
    "runtime": "Node.js",
    "readme_excerpt": "# Bucketeer MCP Server\n\nA Model Context Protocol (MCP) server for managing feature flags in [Bucketeer](https://bucketeer.io/), an open-source feature flag management platform.\n\n\n> [!WARNING]\n> This is a beta version. Breaking changes may be introduced before general release.\n\n## Features\n\nThis MCP server provides tools for basic CRUD operations on Bucketeer feature flags:\n\n- `listFeatureFlags` - List all feature flags with filtering and pagination\n- `createFeatureFlag` - Create a new feature flag\n- `getFeatureFlag` - Get a specific feature flag by ID\n- `updateFeatureFlag` - Update an existing feature flag\n- `archiveFeatureFlag` - Archive a feature flag (make it inactive)\n\n## Prerequisites\n\n- Node.js 18 or higher\n- A Bucketeer instance with API access\n- An API key with appropriate permissions (READ, WRITE, or ADMIN)\n\n## Installation\n\n### Using npx (Recommended)\n\nThe easiest way to use Bucketeer MCP Server is directly with `npx` - no installation required:\n\n```bash\nnpx @bucketeer/mcp\n```\n\n### Local Installation\n\n1. Clone this repository\n```bash\ngit clone https://github.com/bucketeer-io/bucketeer-mcp.git\ncd bucketeer-mcp\n```\n\n2. Install dependencies\n```bash\nnpm install\n```\n\n3. Build the project\n```bash\nnpm run build\n```\n\n## Usage\n\n### Running the Server\n\n#### Using npx (No Installation Required)\n\n```bash\nnpx @bucketeer/mcp\n```\n\n#### Using Local Installation\n\nStart the MCP server\n```bash\nnpm start\n```\n\nFor development with auto-reload\n```bash\nnpm run dev\n```\n\n### MCP Client Conf",
    "quality_score": 55
  },
  "enriched_at": "2025-11-17T17:50:24.270877"
}